{
  "binding_force": "binding-invariant",
  "binding_rule_semantic_digest": "sha256:1111111111111111111111111111111111111111111111111111111111111111",
  "changed_non_core_paths": [
    "src/lib.rs"
  ],
  "cited_evidence_digests": [
    "sha256:4444444444444444444444444444444444444444444444444444444444444444"
  ],
  "new_manifest_digest": "sha256:3333333333333333333333333333333333333333333333333333333333333333",
  "old_manifest_digest": "sha256:2222222222222222222222222222222222222222222222222222222222222222",
  "prior_breach_digest": "sha256:0000000000000000000000000000000000000000000000000000000000000000",
  "rule_unweakened": true,
  "run_id": "run-1",
  "schema": "breach-remediation-v1"
}
